{
  "request_id": "req-footing-001",
  "schema_version": "1.0",
  "language": "ar",
  "discipline": "structural",
  "intent": {
    "deliverable_type": "design_and_draw",
    "element_type": "isolated_footing",
    "description": "قاعدة منفصلة مربعة تحت عمود خرساني، تربة متماسكة، عمق تأسيس 1.5 متر"
  },
  "units": {
    "length": "m",
    "force": "kN",
    "stress": "MPa",
    "area": "mm2"
  },
  "inputs": {
    "column_load_kN": 800,
    "column_size_m": { "width": 0.40, "depth": 0.40 },
    "bearing_capacity_kPa": 150,
    "foundation_depth_m": 1.5,
    "concrete_fck_MPa": 25,
    "steel_fyk_MPa": 420,
    "cover_mm": 50,
    "soil_unit_weight_kNm3": 18,
    "footing_self_weight_included": true
  },
  "design_code": {
    "primary": "ACI 318-19"
  },
  "constraints": {
    "max_footing_side_m": 3.0,
    "min_footing_depth_mm": 300
  },
  "required_outputs": {
    "drawing": true,
    "report": true,
    "validation_log": true,
    "json_result": true
  },
  "metadata": {
    "project_name": "مشروع المبنى الإداري - الرياض",
    "engineer": "م. علي",
    "revision": "R0"
  }
}
